[
  {
    "id": "volvo-ec230-electric",
    "model": "EC230 Electric",
    "oem": "Volvo Construction Equipment",
    "country": "Sweden",
    "machine_type": "Excavator",
    "power_use": "Battery electric",
    "class_tonnage": "23 t",
    "engine_power_kw": "Peak 160 / Continuous 105",
    "blade_size_mm": "",
    "bucket_size_m3": "",
    "year_of_release": "2024 (NA launch)",
    "status": "Released",
    "source_link": "https://www.equipmentworld.com/construction-equipment/heavy-equipment/excavators/article/15676435/volvos-new-ec230-is-largest-electric-excavator-on-us-market",
    "source_date": "2024-05-31",
    "notes": "Runtime 4–5 h typical; DC fast charge to extend shift"
  },
  {
    "id": "volvo-l25-electric",
    "model": "L25 Electric",
    "oem": "Volvo Construction Equipment",
    "country": "Sweden",
    "machine_type": "Wheel loader",
    "power_use": "Battery electric",
    "class_tonnage": "~5.3 t",
    "engine_power_kw": "Drive 22 / Hydraulics 14",
    "blade_size_mm": "",
    "bucket_size_m3": "0.8–0.95",
    "year_of_release": "",
    "status": "Released",
    "source_link": "https://www.volvoce.com/-/media/aprimo/pdf/electric-compact-wheel-loaders/l25-electric/product-guide-l25-electric-en-22-20062470-a.pdf",
    "source_date": "",
    "notes": "48 V, 40 kWh battery"
  },
  {
    "id": "cat-793-bev-early-learner",
    "model": "Cat 793 XE Early Learner (battery-electric)",
    "oem": "Caterpillar",
    "country": "USA",
    "machine_type": "Dump truck",
    "power_use": "Battery electric",
    "class_tonnage": "231 t payload (haul truck)",
    "engine_power_kw": "",
    "blade_size_mm": "",
    "bucket_size_m3": "",
    "year_of_release": "2025 (site trials)",
    "status": "Under development / testing",
    "source_link": "https://www.bhp.com/news/media-centre/releases/2025/12/bhp-and-rio-tinto-welcome-first-caterpillar-battery-electric-haul-trucks-to-the-pilbara",
    "source_date": "2025-12-05",
    "notes": "Early Learner program testing at BHP/Rio Tinto sites"
  },
  {
    "id": "komatsu-hb215lc-1",
    "model": "HB215LC-1 Hybrid",
    "oem": "Komatsu",
    "country": "Japan",
    "machine_type": "Excavator",
    "power_use": "Diesel-electric hybrid",
    "class_tonnage": "21.2 t",
    "engine_power_kw": "110 (148 hp)",
    "blade_size_mm": "",
    "bucket_size_m3": "max 1.36",
    "year_of_release": "2011",
    "status": "Released",
    "source_link": "https://www.komatsu.co.nz/getattachment/ae1380e3-5236-4923-a9ff-605cb4906fcb/HB205_215LC_CEN00450-00_201101.pdf",
    "source_date": "2011-01-01",
    "notes": "Hybrid swing motor with ultracapacitor; ~25% fuel reduction vs PC200-8"
  },
  {
    "id": "komatsu-pc210lce-11",
    "model": "PC210LCE-11 (battery-electric)",
    "oem": "Komatsu",
    "country": "Japan",
    "machine_type": "Excavator",
    "power_use": "Battery electric",
    "class_tonnage": "24.4 t",
    "engine_power_kw": "123 (motor)",
    "blade_size_mm": "",
    "bucket_size_m3": "0.50–0.93",
    "year_of_release": "2023 (rental intro)",
    "status": "Released (rental / selected markets)",
    "source_link": "https://www.komatsu.eu/en/news/komatsu-ready-to-launch-new-20-tonnes-class-electric-excavators",
    "source_date": "2023-09-26",
    "notes": "Battery 450 kWh; CCS Type 2; 5–10 h continuous operation depending on duty"
  },
  {
    "id": "hitachi-zx55u-6eb",
    "model": "ZX55U-6EB",
    "oem": "Hitachi Construction Machinery",
    "country": "Japan",
    "machine_type": "Excavator",
    "power_use": "Battery electric",
    "class_tonnage": "5.33 t",
    "engine_power_kw": "33",
    "blade_size_mm": "",
    "bucket_size_m3": "0.14",
    "year_of_release": "2022",
    "status": "Released (EU)",
    "source_link": "https://www.earthmoversmagazine.co.uk/news/view,new-electric-hitachi-zx55u6eb-excavator_5386.htm",
    "source_date": "2022-07-05",
    "notes": "39.4 kWh battery; wired operation option"
  },
  {
    "id": "liebherr-r9xx-h2",
    "model": "R 9XX H2 (hydrogen ICE prototype)",
    "oem": "Liebherr",
    "country": "France/Germany",
    "machine_type": "Excavator",
    "power_use": "Hydrogen (combustion)",
    "class_tonnage": "~50 t",
    "engine_power_kw": "H966 H2 ICE (PFI)",
    "blade_size_mm": "",
    "bucket_size_m3": "",
    "year_of_release": "2022 (prototype)",
    "status": "Under development",
    "source_link": "https://www.liebherr.com/en-int/n/5-things-you-may-not-have-known-about-the-r-9xx-h-2-crawler-excavator-with-hydrogen-engine-28039-3935641",
    "source_date": "2022-10-22",
    "notes": "Shown at Bauma 2022; near-zero CO2 tank-to-wheel"
  },
  {
    "id": "hyundai-hw155h",
    "model": "HW155H (hydrogen fuel cell concept)",
    "oem": "HD Hyundai Construction Equipment",
    "country": "South Korea",
    "machine_type": "Excavator",
    "power_use": "Hydrogen fuel cell",
    "class_tonnage": "14–15 t (wheeled)",
    "engine_power_kw": "Fuel cell 70–100",
    "blade_size_mm": "",
    "bucket_size_m3": "",
    "year_of_release": "2025 (planned showcase)",
    "status": "Under development",
    "source_link": "https://electrek.co/2025/01/27/hd-hyundai-set-to-debut-production-14-ton-hydrogen-wheeled-excavator/",
    "source_date": "2025-01-27",
    "notes": "Production unveil targeted around bauma 2025"
  },
  {
    "id": "xcmg-xc968-ev",
    "model": "XC968-EV",
    "oem": "XCMG",
    "country": "China",
    "machine_type": "Wheel loader",
    "power_use": "Battery electric",
    "class_tonnage": "19–20 t (rated load 6,000 kg)",
    "engine_power_kw": "Drive 2×120; Hydraulics 80",
    "blade_size_mm": "",
    "bucket_size_m3": "3.5",
    "year_of_release": "",
    "status": "Released",
    "source_link": "https://www.xcmgglobal.com/product/pro-detail.jsp?id=122450",
    "source_date": "",
    "notes": "Battery options 282–423 kWh per regional specs"
  },
  {
    "id": "develon-dx20ze-7",
    "model": "DX20ZE-7",
    "oem": "DEVELON (formerly Doosan)",
    "country": "South Korea",
    "machine_type": "Excavator",
    "power_use": "Battery electric",
    "class_tonnage": "~2 t",
    "engine_power_kw": "13.7",
    "blade_size_mm": "",
    "bucket_size_m3": "0.05",
    "year_of_release": "2023",
    "status": "Released",
    "source_link": "https://www.earthmoversmagazine.co.uk/news/view,new-develon-dx20ze7-electric-miniexcavator_6185.htm",
    "source_date": "2023-09-05",
    "notes": "20.4 kWh Li-ion; fast charge to 80% ≈ 1h20"
  },
  {
    "id": "epiroc-mt42-battery",
    "model": "Minetruck MT42 Battery",
    "oem": "Epiroc",
    "country": "Sweden",
    "machine_type": "Dump truck",
    "power_use": "Battery electric",
    "class_tonnage": "42 t payload (underground)",
    "engine_power_kw": "",
    "blade_size_mm": "",
    "bucket_size_m3": "",
    "year_of_release": "~2021",
    "status": "Released",
    "source_link": "https://www.epiroc.com/content/dam/epiroc/underground-mining-and-tunneling/lhd/minetruck/minetruck-mt42-battery/9869%200138%2001g%20Minetruck%20MT42%20Battery%20Technical%20Specification_low%20res.pdf",
    "source_date": "",
    "notes": "Zero-emission underground haul truck"
  },
  {
    "id": "sandvik-lh518b",
    "model": "LH518B (battery-electric LHD)",
    "oem": "Sandvik Mining and Rock Solutions",
    "country": "Sweden/Finland",
    "machine_type": "Wheel loader",
    "power_use": "Battery electric",
    "class_tonnage": "18 t payload (underground LHD)",
    "engine_power_kw": "Electric driveline up to ~600 kW",
    "blade_size_mm": "",
    "bucket_size_m3": "6.3–6.6",
    "year_of_release": "2021",
    "status": "Released",
    "source_link": "https://www.mining.sandvik/globalassets/products/underground-loaders-and-trucks/pdf/lh518b-technical-specifications-english.pdf",
    "source_date": "",
    "notes": "AutoSwap battery system"
  },
  {
    "id": "volvo-hx04",
    "model": "HX04 (fuel cell articulated hauler prototype)",
    "oem": "Volvo Construction Equipment",
    "country": "Sweden",
    "machine_type": "Dump truck",
    "power_use": "Hydrogen fuel cell",
    "class_tonnage": "Articulated hauler (prototype)",
    "engine_power_kw": "",
    "blade_size_mm": "",
    "bucket_size_m3": "",
    "year_of_release": "2022 (prototype testing)",
    "status": "Under development",
    "source_link": "https://www.volvoce.com/global/en/news-and-events/news-and-stories/2022/volvo-ce-starts-testing-of-the-worlds-first-prototype-hydrogen-articulated-hauler/",
    "source_date": "2022-06-13",
    "notes": "Hydrogen refueling ~7.5 min for ~4 h operation (prototype)"
  },
  {
    "id": "edumper-hd605-conversion",
    "model": "eDumper (Komatsu HD605-7 conversion)",
    "oem": "eMining / Lithium System (base Komatsu)",
    "country": "Switzerland",
    "machine_type": "Dump truck",
    "power_use": "Battery electric",
    "class_tonnage": "65 t payload (conversion)",
    "engine_power_kw": "Drive 634 kW (sync motor)",
    "blade_size_mm": "",
    "bucket_size_m3": "",
    "year_of_release": "2017–2018 (in operation)",
    "status": "Released",
    "source_link": "https://lithiumsystem.ch/projekte/edumper/",
    "source_date": "",
    "notes": "~600 kWh battery; regenerative downhill energy surplus"
  },
  {
    "id": "cat-d6-xe",
    "model": "D6 XE (electric-drive dozer)",
    "oem": "Caterpillar",
    "country": "USA",
    "machine_type": "Bulldozer",
    "power_use": "Diesel-electric hybrid",
    "class_tonnage": "~23 t (varies by config)",
    "engine_power_kw": "161 (net)",
    "blade_size_mm": "",
    "bucket_size_m3": "",
    "year_of_release": "",
    "status": "Released",
    "source_link": "https://www.cat.com/en_US/products/new/equipment/dozers/medium-dozers/15969752.html",
    "source_date": "",
    "notes": "High-drive electric drive; up to ~35% better fuel efficiency vs D6T"
  },
  {
    "id": "xcmg-gr350ep",
    "model": "GR350EP (battery-electric motor grader)",
    "oem": "XCMG",
    "country": "China",
    "machine_type": "Grader",
    "power_use": "Battery electric",